Rank,Title,Date,Daily Average
1,Avis de recrutement : Assistant(e) RH en charge de la paie,"février 22, 20240",OK PLAST OP   recrute pour des besoins de nos services   Assistant(e) RH en charge de la paie. Ville : Douala Date limite :  10 Mars 2024 Missions principales  Préparer les éléments de paie et établir les bulletins de paie Assurer la bonne gestion des ret…
2,Offre d'emploi : Comptable - BEKO CAPITAL ADVISORY S.A,"février 22, 20240","BEKO CAPITAL ADVISORY S.A. Société de Bourse localisée dans la ville de   Douala, recrute un Comptable ayant une expérience dans le secteur de la bourse   et/ou bancaire.   Responsabilités et attributions                 Placée sous la supervision hiérar…"
3, Appel à candidature : Chauffeurs - Yango,"février 22, 20240","Recherche des chauffeurs et voiture souhaitant s'enregistrer sur la plate   forme Yango.      Venture SARL  partenaire Yango, Met à votre disposition les conditions   nécessaires pour pouvoir travailler à votre propre compte .      Vous avez un véhic…"
4,Job offer: Nutrition Field Monitor,"février 22, 20240","Job Title:  Nutrition Field Monitor   Reports to:  Project Manager   Duty station :  Bamenda       Type of contract :  Fixed Term   Disponibility:  Immediate   Main objective and tasks      Under the supervision of the Project Manager, the Nutrition Fiel…"
5,Job offer: Project Coordinator - Goethe-Institut Cameroon,"février 22, 20240","The Goethe-Institut Cameroon  is looking for a project coordinator   (m/f/d) on a fee basis to supervise the pre-integration project in Cameroon   from March 1st, 2024 for a limited period until June 30th, 2025, if necessary   with the option of an exten…"
6,Avis de recrutement : vingt 20 employés journaliers,"février 22, 20240","UD MANPOWER AND SERVICES CAMEROON LTD  recrute pour les besoins d'un de   ses clients, vingt (20) employés journaliers dans la ville de Kribi   (Nieté).    Missions                 Ils seront chargés d'effectuer des travaux opérations de dressing…"
7,Job offer: IT Lecturers,"février 22, 20240",The  ICT University  is gearing up to welcome new and returning students!            The ICT University is currently accepting applications for full-time positions   in the Department of ICT and Computer Sciences. Applicants must hold a Ph.D.   or its eq…
